{
  "$schema": "source-lock.schema.json",
  "schemaVersion": 1,
  "generatedBy": "scripts/build/source_lock.py",
  "workspace": {
    "source": "https://github.com/Pascu-Victor/wos.git",
    "license": "Apache-2.0"
  },
  "gitSources": [
    {
      "id": "limine",
      "path": "modules/extern/limine",
      "urls": ["https://github.com/limine-bootloader/limine.git"],
      "commit": "d33fb37a911738f7786e313065a81ffa79800403",
      "treeSha256": "a22de336a40fe5798ea0d9228d05c83cd07d56784655bccc7886708311e90b90",
      "license": "BSD-2-Clause",
      "role": "boot protocol headers"
    },
    {
      "id": "llvm-project",
      "path": "toolchain/src/llvm-project",
      "urls": ["https://github.com/Pascu-Victor/llvm-project.git"],
      "commit": "02f6b2fa43468f3c695ac20c185f331a28d57786",
      "treeSha256": "a7fe1fde97592335608fb7a5ad4bc04e292662c2c1f47af4d1f933325f528fd7",
      "license": "Apache-2.0 WITH LLVM-exception",
      "role": "host and target compiler runtimes"
    },
    {
      "id": "mlibc",
      "path": "toolchain/src/mlibc",
      "urls": ["https://github.com/Pascu-Victor/mlibc.git"],
      "commit": "17fdb933d0ab5624ef027efb2bc5473744c10713",
      "treeSha256": "55f78f5649a6e09f14513457ea484dcea10e170e9cfbc8b33ae5900aa4890131",
      "license": "MIT",
      "role": "WOS libc"
    },
    {
      "id": "dropbear",
      "path": "toolchain/src/dropbear",
      "urls": ["https://github.com/Pascu-Victor/dropbear.git"],
      "commit": "fd2461a5c4bb4f8cb2348fe5f72937d35762049d",
      "treeSha256": "557fa42ebb9e621a34f48790f7c30fbbbd555bcab3e8b629c3347c121ea3c38b",
      "license": "MIT AND BSD-2-Clause AND Public-Domain",
      "role": "SSH userspace"
    },
    {
      "id": "busybox",
      "path": "toolchain/src/busybox",
      "urls": ["https://github.com/Pascu-Victor/busybox.git"],
      "commit": "1a5a194bc692cbfcdb16a31395476c5c131f6834",
      "treeSha256": "946d92c935cbb8c1cb97ac065af06234f05848402f38a88a1096530f421d7a45",
      "license": "GPL-2.0-only",
      "role": "base userspace"
    },
    {
      "id": "wiremcp",
      "path": "tools/wireshark/WireMCP",
      "urls": ["https://github.com/0xKoda/WireMCP.git"],
      "commit": "7f45f8b2b4adeb76be8c6227eefb38533fdd6b1e",
      "treeSha256": "64dc20604fc24c1487b3614c8b30dcee4721c70be8bdc8a703e090727d9533df",
      "license": "MIT",
      "role": "Wireshark host integration"
    },
    {
      "id": "cmake",
      "path": "toolchain/src/cmake",
      "urls": ["https://github.com/Pascu-Victor/CMake.git"],
      "commit": "952ea1dd5bdecdcbe65907cbdd9bec8f6f49edb8",
      "treeSha256": "fcf5f45b88b301c7d72c3526509f7a0b6943cd8b2809b2d5827b64d3514178af",
      "license": "BSD-3-Clause",
      "role": "host and target build tool"
    },
    {
      "id": "ninja",
      "path": "toolchain/src/ninja",
      "urls": ["https://github.com/Pascu-Victor/ninja.git"],
      "commit": "96a44de024d9450e547cc98a86032a48c5ac42fd",
      "treeSha256": "d9e3cdb12ac9b2a8de3276e082f96cf269d27aaef18bb9437fac0a6d997f71a4",
      "license": "Apache-2.0",
      "role": "target build tool"
    },
    {
      "id": "python",
      "path": "toolchain/src/python",
      "urls": ["https://github.com/Pascu-Victor/cpython.git"],
      "commit": "5ae5aba9fecf61c9af1573d7b608dd035b2eb8d9",
      "treeSha256": "e3e44fa14b446cb7e66eb3d3cef97bbb0c2d5e325b4cebee055235a26c124694",
      "license": "Python-2.0",
      "role": "target interpreter"
    },
    {
      "id": "nasm",
      "path": "toolchain/src/nasm",
      "urls": ["https://github.com/Pascu-Victor/nasm.git"],
      "commit": "dfbf339025439736eefb2346f5d1550dc2e50897",
      "treeSha256": "d04843ee3ae53a00bef36ba84a8de8f795b760b9d7ee7ad653262d829c5d85d0",
      "license": "BSD-2-Clause",
      "role": "target assembler"
    },
    {
      "id": "clang-tidy-cache",
      "path": "toolchain/src/clang-tidy-cache",
      "urls": ["https://github.com/williamfligor/clang-tidy-cache.git"],
      "commit": "36dc3b03b99a0d8fafacab8ad16a5b4dd2136650",
      "treeSha256": "6472bf2df2f32ae13c0600d1e74046a5bf03afe42e844e2993c8597c82c37535",
      "license": "MIT",
      "role": "optional host build cache"
    },
    {
      "id": "git",
      "path": "toolchain/src/git",
      "urls": ["https://github.com/Pascu-Victor/git.git"],
      "commit": "de52f113d4ab707ad8aadc227ad223ab3ff6820c",
      "treeSha256": "d48e756dc6d1efb4acd1c6c2392cd4865fe3d2eff7ba8d20901c8c9aae078294",
      "license": "GPL-2.0-only",
      "role": "target version control"
    },
    {
      "id": "doom-ascii",
      "path": "toolchain/src/doom-ascii",
      "urls": ["https://github.com/wojciech-graj/doom-ascii.git"],
      "commit": "b5188d7c9c4da6c81264a7803e8725ac3df2cfea",
      "treeSha256": "96125f420dd2ac1141ad7a327e24631b20a96a14ff23a7a6cfe305d2b5225556",
      "license": "GPL-2.0-or-later",
      "role": "target demo port"
    },
    {
      "id": "git-sha1collisiondetection",
      "urls": ["https://github.com/cr-marcstevens/sha1collisiondetection.git"],
      "commit": "855827c583bc30645ba427885caa40c5b81764d2",
      "license": "MIT",
      "role": "nested Git submodule with update=none",
      "storeRequired": false
    },
    {
      "id": "mlibc-freestnd-c-hdrs",
      "path": "toolchain/src/mlibc/subprojects/freestnd-c-hdrs",
      "urls": ["https://github.com/osdev0/freestnd-c-hdrs.git"],
      "commit": "d33711241b46ecb8f2ad33927fcefdcb3ac0162e",
      "treeSha256": "361cea2635dd01aef6b6f2a23b57748cbfd6ddf9291d3da1c8583092b199cffb",
      "license": "BSD-2-Clause",
      "role": "mlibc Meson fallback",
      "allowedOverlays": [
        {"path": "meson.build", "sha256": "3ffa0eaec1abaae5ceb7957b3737c07b0c35505218df3effc8ea3ea4150cdbde"},
        {"path": ".meson-subproject-wrap-hash.txt", "sha256": "a64f5c3d6d199166129b396dbb575ca64408ee17206496a1340cb6537657e5b2"}
      ]
    },
    {
      "id": "mlibc-freestnd-cxx-hdrs",
      "path": "toolchain/src/mlibc/subprojects/freestnd-cxx-hdrs",
      "urls": ["https://github.com/osdev0/freestnd-cxx-hdrs.git"],
      "commit": "a6b351e0ab3e74e5789b01fa1447e4cd62373da7",
      "treeSha256": "d9ce3cfeb2905ab6df6c2b6302a491b03bd04f6389a9ba945161e82798bbc800",
      "license": "BSD-2-Clause",
      "role": "mlibc Meson fallback",
      "allowedOverlays": [
        {"path": "meson.build", "sha256": "5f8e85d648f3d1fb3f81473e1ce2c84d1e108a2056df5c86dbb735d285f56150"},
        {"path": ".meson-subproject-wrap-hash.txt", "sha256": "4beb7deef98a2702d0c7a26f2dae89bd740d4e6385539931a4e534a7f0b458a8"}
      ]
    },
    {
      "id": "mlibc-frigg",
      "path": "toolchain/src/mlibc/subprojects/frigg",
      "urls": ["https://github.com/managarm/frigg.git"],
      "commit": "58fb2ab734934cf4b245f833797ab5eeefeb60c0",
      "treeSha256": "0254b3214321affccf7d66fa4b8d0fe7145db45ba3a160f42b85cf517d6472ad",
      "license": "MIT",
      "role": "mlibc Meson fallback"
    },
    {
      "id": "mlibc-libsmarter",
      "path": "toolchain/src/mlibc/subprojects/libsmarter",
      "urls": ["https://github.com/managarm/libsmarter.git"],
      "commit": "f7d061bc37d485418344452c7ceb28d5df3ba85d",
      "treeSha256": "2305ea6bc95e954eb7bf8d51310d89def5fda24b90ec6a6ae00b5ef787d04e78",
      "license": "MIT",
      "role": "mlibc Meson fallback",
      "allowedOverlays": [
        {"path": ".meson-subproject-wrap-hash.txt", "sha256": "0655c7c28a780b8a48e5aadd0931c5fd0f801f92b55c8fc12db670da291c7c4a"}
      ]
    },
    {
      "id": "mlibc-bragi",
      "urls": ["https://github.com/managarm/bragi.git"],
      "commit": "523b86efac124b0d749eed201df0c7ea9f87ee17",
      "license": "MIT",
      "role": "latent mlibc Meson fallback",
      "storeRequired": false
    },
    {
      "id": "googletest",
      "urls": ["https://github.com/google/googletest.git"],
      "commit": "b514bdc898e2951020cbdca1304b75f5950d1f59",
      "license": "BSD-3-Clause",
      "role": "host unit tests",
      "storeRequired": false
    }
  ],
  "archives": [
    {
      "id": "gnu-make",
      "filename": "make-4.4.1.tar.gz",
      "version": "4.4.1",
      "urls": ["https://ftp.gnu.org/gnu/make/make-4.4.1.tar.gz"],
      "sha256": "dd16fb1d67bfab79a72f5e8390735c49e3e8e70b4945a15ab1f81ddb78658fb3",
      "license": "GPL-3.0-or-later",
      "localCandidates": ["toolchain/make-build/src/make-4.4.1.tar.gz"]
    },
    {
      "id": "bash",
      "filename": "bash-5.3.tar.gz",
      "version": "5.3",
      "urls": ["https://ftp.gnu.org/gnu/bash/bash-5.3.tar.gz"],
      "sha256": "0d5cd86965f869a26cf64f4b71be7b96f90a3ba8b3d74e27e8e9d9d5550f31ba",
      "license": "GPL-3.0-or-later",
      "localCandidates": ["toolchain/bash-build/src/bash-5.3.tar.gz", "ktest-data/bash-build/src/bash-5.3.tar.gz"]
    },
    {
      "id": "zlib",
      "filename": "zlib-1.3.1.tar.gz",
      "version": "1.3.1",
      "urls": ["https://zlib.net/fossils/zlib-1.3.1.tar.gz"],
      "sha256": "9a93b2b7dfdac77ceba5a558a580e74667dd6fede4585b91eefb60f03b72df23",
      "license": "Zlib",
      "localCandidates": ["toolchain/zlib-build/src/zlib-1.3.1.tar.gz"]
    },
    {
      "id": "libressl",
      "filename": "libressl-4.3.2.tar.gz",
      "version": "4.3.2",
      "urls": ["https://ftp.openbsd.org/pub/OpenBSD/LibreSSL/libressl-4.3.2.tar.gz"],
      "sha256": "edf01aee24c65d69e6a9efcb9d44bcda682ff9d4f3bbbd95e794e1dfa90847b5",
      "license": "ISC AND BSD-3-Clause",
      "localCandidates": ["toolchain/openssl-build/src/libressl-4.3.2.tar.gz"]
    },
    {
      "id": "curl",
      "filename": "curl-8.20.0.tar.xz",
      "version": "8.20.0",
      "urls": ["https://curl.se/download/curl-8.20.0.tar.xz"],
      "sha256": "63fe2dc148ba0ceae89922ef838f7e5c946272c2e78b7c59fab4b79d3ce2b896",
      "license": "curl",
      "localCandidates": ["toolchain/curl-build/src/curl-8.20.0.tar.xz"]
    },
    {
      "id": "meson",
      "filename": "meson-b300d9578fe62c721afbf4e5c4672ad0c94cb96c.tar.gz",
      "version": "b300d9578fe62c721afbf4e5c4672ad0c94cb96c",